{
  "repository": "My-Workflow-Base",
  "role": "contract_owner",
  "platform_ref_namespace": "my_chat",
  "providers": [],
  "scenario_aliases": [],
  "canonical_objects": [
    { "key": "contract.canonical_ref", "owner": "My-Workflow-Base" },
    { "key": "contract.generation_ticket", "owner": "My-Workflow-Base" },
    { "key": "contract.integration_lock", "owner": "My-Workflow-Base" },
    { "key": "contract.scenario_command_envelope", "owner": "My-Workflow-Base" },
    { "key": "contract.scenario_command_receipt", "owner": "My-Workflow-Base" },
    { "key": "contract.scenario_contract_release", "owner": "My-Workflow-Base" },
    { "key": "contract.scenario_event_envelope", "owner": "My-Workflow-Base" },
    { "key": "contract.scenario_manifest", "owner": "My-Workflow-Base" },
    { "key": "contract.scenario_workspace_activation", "owner": "My-Workflow-Base" },
    { "key": "contract.runtime_kind_registry", "owner": "My-Workflow-Base" },
    { "key": "contract.handoff_kind_registry", "owner": "My-Workflow-Base" }
  ]
}
